<?xml version="1.0" encoding="UTF-8"?>
<entities xmlns="http://namesonnodes.org/ns/entities/2009"
	xmlns:xsi="http://www.w3.org/2001/XMLSchema-instance"
	xsi:schemaLocation="http://namesonnodes.org/ns/entities/2009 http://namesonnodes.org/ns/entities/2009/entities.xsd">

	<!--  BEGIN AUTHORITIES -->

	<AuthorityIdentifier uri="org.namesonnodes.math.resolve.test">
		<entity>
			<Authority>
				<label>
					<Label>
						<name>Names on Nodes Resolver Test</name>
					</Label>
				</label>
			</Authority>
		</entity>
	</AuthorityIdentifier>
	<AuthorityIdentifier uri="urn:isbn:0853010064">
		<entity>
			<Authority>
				<label>
					<Label>
						<name>International Code of Zoological Nomenclature, Fourth Edition</name>
						<abbr>ICZN 4</abbr>
						<italics>true</italics>
					</Label>
				</label>
			</Authority>
		</entity>
	</AuthorityIdentifier>
	<AuthorityIdentifier uri="http://museums.or.ke">
		<entity>
			<Authority>
				<label>
					<Label>
						<name>National Museums of Kenya</name>
						<abbr>KNM</abbr>
					</Label>
				</label>
			</Authority>
		</entity>
	</AuthorityIdentifier>
	<AuthorityIdentifier uri="http://www.africamuseum.be">
		<entity>
			<Authority>
				<label>
					<Label>
						<name>Royal Museum for Central Africa</name>
						<abbr>RMCA</abbr>
					</Label>
				</label>
			</Authority>
		</entity>
	</AuthorityIdentifier>
	<AuthorityIdentifier uri="tel:+0112510111117150">
		<entity>
			<Authority>
				<label>
					<Label>
						<name>Ethiopian National Museum</name>
						<abbr>ENM</abbr>
					</Label>
				</label>
			</Authority>
		</entity>
	</AuthorityIdentifier>
	<AuthorityIdentifier uri="http://houseofculture.or.tz">
		<entity>
			<Authority>
				<label>
					<Label>
						<name>National Museum and House of Culture of Tanzania</name>
						<abbr>TNMHC</abbr>
					</Label>
				</label>
			</Authority>
		</entity>
	</AuthorityIdentifier>
	<AuthorityIdentifier uri="http://web.wits.ac.za">
		<entity>
			<Authority>
				<label>
					<Label>
						<name>University of the Witswatersrand, Johannesburg</name>
						<abbr>Wits</abbr>
					</Label>
				</label>
			</Authority>
		</entity>
	</AuthorityIdentifier>
	<AuthorityIdentifier uri="tel:+27123227632">
		<entity>
			<Authority>
				<label>
					<Label>
						<name>Transvaal Museum</name>
						<abbr>TM</abbr>
					</Label>
				</label>
			</Authority>
		</entity>
	</AuthorityIdentifier>
	<AuthorityIdentifier id="902" uri="http://namesonnodes.org/entities/authorityidentifier/902">
		<entity>
			<Authority>
				<label>
					<Label>
						<name>Mahja Gada University, Jogjakarta</name>
						<abbr>Mahja Gada</abbr>
					</Label>
				</label>
			</Authority>
		</entity>
	</AuthorityIdentifier>
	<AuthorityIdentifier uri="http://naturalis.nl">
		<entity>
			<Authority>
				<label>
					<Label>
						<name>National Museum of Natural History, Netherlands</name>
						<abbr>Naturalis</abbr>
					</Label>
				</label>
			</Authority>
		</entity>
	</AuthorityIdentifier>
	<AuthorityIdentifier uri="http://www.uni-heidelberg.de">
		<entity>
			<Authority>
				<label>
					<Label>
						<name>Universit√§t Heidelberg</name>
						<abbr>Heidelberg</abbr>
					</Label>
				</label>
			</Authority>
		</entity>
	</AuthorityIdentifier>
	<AuthorityIdentifier uri="http://www.rlmb.lvr.de">
		<entity>
			<Authority>
				<label>
					<Label>
						<name>Rheinisches Landsmuseum, Bonn</name>
						<abbr>RLMB</abbr>
					</Label>
				</label>
			</Authority>
		</entity>
	</AuthorityIdentifier>
	<AuthorityIdentifier uri="http://www.uppsaladomkyrka.se">
		<entity>
			<Authority>
				<label>
					<Label>
						<name>Uppsala domkyrka</name>
					</Label>
				</label>
			</Authority>
		</entity>
	</AuthorityIdentifier>

	<!-- END AUTHORITIES -->

	<!--  BEGIN Taxa -->

	<!--  BEGIN Characters -->
	
	<TaxonIdentifier localName="char:cran700%2B">
		<authority>
			<refAuthority>org.namesonnodes.math.resolve.test</refAuthority>
		</authority>
		<label>
			<Label>
				<name>cranial capacity over 700 cc</name>
			</Label>
		</label>
	</TaxonIdentifier>

	<TaxonIdentifier localName="char:zoo-extant">
		<authority>
			<refAuthority>org.namesonnodes.math.resolve.test</refAuthority>
		</authority>
		<label>
			<Label>
				<name>extant (living) as of 1758 January 1</name>
				<abbr>zoo-extant</abbr>
			</Label>
		</label>
	</TaxonIdentifier>

	<!--  END Characters -->
	
	<!--  BEGIN Taxonomic Units -->

	<!--  BEGIN Hypothetical Taxonomic Units -->

	<TaxonIdentifier localName="htu:0">
		<authority>
			<refAuthority>org.namesonnodes.math.resolve.test</refAuthority>
		</authority>
	</TaxonIdentifier>
	<TaxonIdentifier localName="htu:1">
		<authority>
			<refAuthority>org.namesonnodes.math.resolve.test</refAuthority>
		</authority>
	</TaxonIdentifier>
	<TaxonIdentifier localName="htu:2">
		<authority>
			<refAuthority>org.namesonnodes.math.resolve.test</refAuthority>
		</authority>
	</TaxonIdentifier>
	<TaxonIdentifier localName="htu:3">
		<authority>
			<refAuthority>org.namesonnodes.math.resolve.test</refAuthority>
		</authority>
	</TaxonIdentifier>
	<TaxonIdentifier localName="htu:4">
		<authority>
			<refAuthority>org.namesonnodes.math.resolve.test</refAuthority>
		</authority>
	</TaxonIdentifier>
	<TaxonIdentifier localName="htu:5">
		<authority>
			<refAuthority>org.namesonnodes.math.resolve.test</refAuthority>
		</authority>
	</TaxonIdentifier>
	<TaxonIdentifier localName="htu:6">
		<authority>
			<refAuthority>org.namesonnodes.math.resolve.test</refAuthority>
		</authority>
	</TaxonIdentifier>
	<TaxonIdentifier localName="htu:7">
		<authority>
			<refAuthority>org.namesonnodes.math.resolve.test</refAuthority>
		</authority>
	</TaxonIdentifier>
	<TaxonIdentifier localName="htu:8">
		<authority>
			<refAuthority>org.namesonnodes.math.resolve.test</refAuthority>
		</authority>
	</TaxonIdentifier>
	<TaxonIdentifier localName="htu:9">
		<authority>
			<refAuthority>org.namesonnodes.math.resolve.test</refAuthority>
		</authority>
	</TaxonIdentifier>
	<TaxonIdentifier localName="htu:10">
		<authority>
			<refAuthority>org.namesonnodes.math.resolve.test</refAuthority>
		</authority>
	</TaxonIdentifier>
	<TaxonIdentifier localName="htu:11">
		<authority>
			<refAuthority>org.namesonnodes.math.resolve.test</refAuthority>
		</authority>
	</TaxonIdentifier>
	<TaxonIdentifier localName="htu:12">
		<authority>
			<refAuthority>org.namesonnodes.math.resolve.test</refAuthority>
		</authority>
	</TaxonIdentifier>
	<TaxonIdentifier localName="htu:13">
		<authority>
			<refAuthority>org.namesonnodes.math.resolve.test</refAuthority>
		</authority>
	</TaxonIdentifier>
	<TaxonIdentifier localName="htu:14">
		<authority>
			<refAuthority>org.namesonnodes.math.resolve.test</refAuthority>
		</authority>
	</TaxonIdentifier>
	<TaxonIdentifier localName="htu:15">
		<authority>
			<refAuthority>org.namesonnodes.math.resolve.test</refAuthority>
		</authority>
		<entity>
			<refTaxon>org.namesonnodes.math.resolve.test::htu:0</refTaxon>
		</entity>
	</TaxonIdentifier>
	<TaxonIdentifier localName="htu:16">
		<authority>
			<refAuthority>org.namesonnodes.math.resolve.test</refAuthority>
		</authority>
		<entity>
			<refTaxon>org.namesonnodes.math.resolve.test::htu:2</refTaxon>
		</entity>
	</TaxonIdentifier>
	<TaxonIdentifier localName="htu:17">
		<authority>
			<refAuthority>org.namesonnodes.math.resolve.test</refAuthority>
		</authority>
	</TaxonIdentifier>
	<TaxonIdentifier localName="htu:18">
		<authority>
			<refAuthority>org.namesonnodes.math.resolve.test</refAuthority>
		</authority>
	</TaxonIdentifier>
	<TaxonIdentifier localName="htu:19">
		<authority>
			<refAuthority>org.namesonnodes.math.resolve.test</refAuthority>
		</authority>
		<entity>
			<refTaxon>org.namesonnodes.math.resolve.test::htu:6</refTaxon>
		</entity>
	</TaxonIdentifier>
	<TaxonIdentifier localName="htu:20">
		<authority>
			<refAuthority>org.namesonnodes.math.resolve.test</refAuthority>
		</authority>
	</TaxonIdentifier>
	<TaxonIdentifier localName="htu:21">
		<authority>
			<refAuthority>org.namesonnodes.math.resolve.test</refAuthority>
		</authority>
	</TaxonIdentifier>
	<TaxonIdentifier localName="htu:22">
		<authority>
			<refAuthority>org.namesonnodes.math.resolve.test</refAuthority>
		</authority>
		<entity>
			<refTaxon>org.namesonnodes.math.resolve.test::htu:9</refTaxon>
		</entity>
	</TaxonIdentifier>
	<TaxonIdentifier localName="htu:23">
		<authority>
			<refAuthority>org.namesonnodes.math.resolve.test</refAuthority>
		</authority>
		<entity>
			<refTaxon>org.namesonnodes.math.resolve.test::htu:10</refTaxon>
		</entity>
	</TaxonIdentifier>
	<TaxonIdentifier localName="htu:24">
		<authority>
			<refAuthority>org.namesonnodes.math.resolve.test</refAuthority>
		</authority>
	</TaxonIdentifier>
	<TaxonIdentifier localName="htu:25">
		<authority>
			<refAuthority>org.namesonnodes.math.resolve.test</refAuthority>
		</authority>
		<entity>
			<refTaxon>org.namesonnodes.math.resolve.test::htu:13</refTaxon>
		</entity>
	</TaxonIdentifier>
	<TaxonIdentifier localName="htu:26">
		<authority>
			<refAuthority>org.namesonnodes.math.resolve.test</refAuthority>
		</authority>
	</TaxonIdentifier>
	<TaxonIdentifier localName="htu:27">
		<authority>
			<refAuthority>org.namesonnodes.math.resolve.test</refAuthority>
		</authority>
	</TaxonIdentifier>
	<TaxonIdentifier localName="htu:28">
		<authority>
			<refAuthority>org.namesonnodes.math.resolve.test</refAuthority>
		</authority>
		<entity>
			<refTaxon>org.namesonnodes.math.resolve.test::htu:2</refTaxon>
		</entity>
	</TaxonIdentifier>
	<TaxonIdentifier localName="htu:29">
		<authority>